{
  "$schema": "https://json-schema.org/draft/2020-12/schema",
  "$id": "https://forever.works/schemas/0.1/implementation.schema.json",
  "title": "Implementation",
  "description": "Canonical Forever Works implementation record. Unknown fields are preserved for compatible extension.",
  "type": "object",
  "required": [
    "foreverVersion",
    "id",
    "kind",
    "type",
    "technology",
    "satisfiesCapabilities"
  ],
  "properties": {
    "foreverVersion": {
      "type": "string",
      "pattern": "^0\\.[0-9]+$",
      "description": "Forever Works schema version."
    },
    "id": {
      "type": "string",
      "pattern": "^[a-z][a-z0-9]*(?:[._-][a-z0-9]+)*$",
      "description": "Stable, globally unique entity identifier."
    },
    "kind": {
      "const": "implementation"
    },
    "provenance": {
      "$ref": "common.schema.json#/$defs/provenance"
    },
    "extensions": {
      "type": "object",
      "propertyNames": {
        "pattern": "^[a-z0-9]+(?:[.-][a-z0-9]+)+$"
      },
      "additionalProperties": true
    },
    "type": {
      "type": "string"
    },
    "technology": {
      "type": "string"
    },
    "version": {
      "type": "string"
    },
    "satisfiesCapabilities": {
      "type": "array",
      "items": {
        "type": "string"
      },
      "uniqueItems": true,
      "description": "Stable entity ID references."
    },
    "constrainedByInvariants": {
      "type": "array",
      "items": {
        "type": "string"
      },
      "uniqueItems": true,
      "description": "Stable entity ID references."
    },
    "satisfiesConstraints": {
      "type": "array",
      "items": {
        "type": "string"
      },
      "uniqueItems": true,
      "description": "Stable entity ID references."
    },
    "compatibilityContracts": {
      "type": "array",
      "items": {
        "type": "string"
      },
      "uniqueItems": true,
      "description": "Stable entity ID references."
    },
    "replaceability": {
      "type": "string"
    },
    "sourceLocations": {
      "type": "array",
      "items": {
        "type": "string"
      },
      "uniqueItems": true,
      "description": "Ordered descriptive strings; not entity references."
    },
    "runtimeRequirements": {
      "type": "array",
      "items": {
        "type": "string"
      },
      "uniqueItems": true,
      "description": "Ordered descriptive strings; not entity references."
    },
    "claims": {
      "type": "array",
      "items": {
        "$ref": "common.schema.json#/$defs/claim"
      }
    }
  },
  "additionalProperties": true,
  "examples": [
    {
      "foreverVersion": "0.1",
      "id": "implementation.example",
      "kind": "implementation",
      "type": "library",
      "technology": "portable implementation",
      "satisfiesCapabilities": [
        "capability.example"
      ]
    }
  ]
}
