{
  "foreverVersion": "0.1",
  "id": "implementation.catalog",
  "kind": "implementation",
  "type": "local-service",
  "technology": "Independent HTTP process, own SQLite database; shared reference runtime mechanism",
  "satisfiesCapabilities": [
    "capability.catalog"
  ],
  "constrainedByInvariants": [
    "invariant.catalog"
  ],
  "sourceLocations": [
    "CONTRACT.md"
  ],
  "claims": [],
  "provenance": {
    "sourceType": "agent-proposed",
    "sourceReference": "Source-aware producer preparation; independent construction NOT_RUN",
    "confidence": 1,
    "reviewStatus": "unreviewed"
  }
}
