{
  "foreverVersion": "0.1",
  "id": "implementation.old-streamer",
  "kind": "implementation",
  "type": "library",
  "technology": "old Node streaming package",
  "version": "4.2.1",
  "satisfiesCapabilities": [
    "capability.streaming",
    "capability.resumability"
  ],
  "constrainedByInvariants": [
    "invariant.bounded-memory"
  ],
  "satisfiesConstraints": [
    "constraint.portable"
  ],
  "compatibilityContracts": [
    "compatibility.configuration-v1"
  ],
  "replaceability": "CAPABILITY",
  "sourceLocations": [
    "src/transfer"
  ],
  "runtimeRequirements": [
    "historical Node runtime"
  ],
  "provenance": {
    "sourceType": "explicit",
    "sourceReference": "project author",
    "confidence": 1,
    "reviewStatus": "accepted"
  }
}
